La faille Dirty Pipe s'en prend aussi aux conteneurs;https://www.lemondeinformatique.fr/actualites/lire-la-faille-dirty-pipe-s-en-prend-aussi-aux-conteneurs-86092.html;le 11 Mars 2022;https://images.itnewsinfo.com/lmi/articles/moyen/000000084420.jpg
La faille Dirty Pipe menace les distributions Linux et Android;https://www.lemondeinformatique.fr/actualites/lire-la-faille-dirty-pipe-menace-les-distributions-linux-et-android-86054.html;le 08 Mars 2022;https://images.itnewsinfo.com/lmi/articles/moyen/000000084346.jpg
Une faille vulnerabilise le gestionnaire de paquets Snap pour Linux;https://www.lemondeinformatique.fr/actualites/lire-une-faille-vulnerabilise-le-gestionnaire-de-paquets-snap-pour-linux-85889.html;le 21 Février 2022;https://images.itnewsinfo.com/lmi/articles/moyen/000000084012.jpg
Chrome OS Flex change de vieux PC et Mac en Chromebook;https://www.lemondeinformatique.fr/actualites/lire-chrome-os-flex-change-de-vieux-pc-et-mac-en-chromebook-85843.html;le 16 Février 2022;https://images.itnewsinfo.com/lmi/articles/moyen/000000083929.jpg
Un bug dans Samba ouvre des acces root a distance;https://www.lemondeinformatique.fr/actualites/lire-un-bug-dans-samba-ouvre-des-acces-root-a-distance-85643.html;le 01 Février 2022;https://images.itnewsinfo.com/lmi/articles/moyen/000000083646.jpg
Les distributions Linux empoisonnees par la faille PwnKit;https://www.lemondeinformatique.fr/actualites/lire-les-distributions-linux-empoisonnees-par-la-faille-pwnkit-85580.html;le 26 Janvier 2022;https://images.itnewsinfo.com/lmi/articles/moyen/000000083522.jpg
HP etoffe sa gamme Elite Dragonfly  avec une version Chromebook;https://www.lemondeinformatique.fr/actualites/lire-hp-etoffe-sa-gamme-elite-dragonfly-avec-une-version-chromebook-85433.html;le 13 Janvier 2022;https://images.itnewsinfo.com/lmi/articles/moyen/000000083289.jpg
Le cybergang AvosLocker veut chiffrer les VM ESXi de VMware;https://www.lemondeinformatique.fr/actualites/lire-le-cybergang-avoslocker-veut-chiffrer-les-vm-esxi-de-vmware-85401.html;le 12 Janvier 2022;https://images.itnewsinfo.com/lmi/articles/moyen/000000083236.jpg
Plus de 2000 correctifs pour accelerer les builds du noyau Linux;https://www.lemondeinformatique.fr/actualites/lire-plus-de-2000-correctifs-pour-accelerer-les-builds-du-noyau-linux-85295.html;le 03 Janvier 2022;https://images.itnewsinfo.com/lmi/articles/moyen/000000083078.jpg
Faille dans Log4j : L'immense travail d'inventaire des systemes touches;https://www.lemondeinformatique.fr/actualites/lire-faille-dans-log4j-l-immense-travail-d-inventaire-des-systemes-touches-85132.html;le 15 Décembre 2021;https://images.itnewsinfo.com/lmi/articles/moyen/000000082774.jpg
AWS s'appuie sur Fedora pour sa distribution Linux;https://www.lemondeinformatique.fr/actualites/lire-aws-s-appuie-sur-fedora-pour-sa-distribution-linux-84913.html;le 25 Novembre 2021;https://images.itnewsinfo.com/lmi/articles/moyen/000000082371.png
Manutan : les enseignements d'une attaque par ransomware (MAJ);https://www.lemondeinformatique.fr/actualites/lire-manutan-les-enseignements-d-une-attaque-par-ransomware-maj-84897.html;le 25 Novembre 2021;https://images.itnewsinfo.com/lmi/articles/moyen/000000082338.jpg
RHEL 8.5 renforce le cap vers la conteneurisation et le multicloud;https://www.lemondeinformatique.fr/actualites/lire-rhel-85-renforce-le-cap-vers-la-conteneurisation-et-le-multicloud-84824.html;le 17 Novembre 2021;https://images.itnewsinfo.com/lmi/articles/moyen/000000082203.jpg
Les systemes critiques exposes a des failles TCP/IP dans Nucleus;https://www.lemondeinformatique.fr/actualites/lire-les-systemes-critiques-exposes-a-des-failles-tcp-ip-dans-nucleus-84780.html;le 12 Novembre 2021;https://images.itnewsinfo.com/lmi/articles/moyen/000000082106.jpg
Edge, securite et automatisation au menu de la version beta de RHEL 9;https://www.lemondeinformatique.fr/actualites/lire-edge-securite-et-automatisation-au-menu-de-la-version-beta-de-rhel-9-84710.html;le 04 Novembre 2021;https://images.itnewsinfo.com/lmi/articles/moyen/000000081962.jpg
FontOnLake, des malwares discrets pour les systemes Linux;https://www.lemondeinformatique.fr/actualites/lire-fontonlake-des-malwares-discrets-pour-les-systemes-linux-84445.html;le 12 Octobre 2021;https://images.itnewsinfo.com/lmi/articles/moyen/000000081451.png
