OpenSSL plombe par une importante faille de securite;https://www.lemondeinformatique.fr/actualites/lire-openssl-plombe-par-une-importante-faille-de-securite-86156.html;le 17 Mars 2022;https://images.itnewsinfo.com/lmi/articles/moyen/000000084542.jpg
Oracle lance 11 services sur son cloud public OCI;https://www.lemondeinformatique.fr/actualites/lire-oracle-lance-11-services-sur-son-cloud-public-oci-86140.html;le 15 Mars 2022;https://images.itnewsinfo.com/lmi/articles/moyen/000000084524.jpeg
SentinelOne rachete Attivo Networks pour 617 M$;https://www.lemondeinformatique.fr/actualites/lire-sentinelone-rachete-attivo-networks-pour-617-m$-86147.html;le 16 Mars 2022;https://images.itnewsinfo.com/lmi/articles/moyen/000000084523.png
Comment les institutions francaises peuvent-elles echapper a la menace ransomware ?;https://www.lemondeinformatique.fr/actualites/lire-comment-les-institutions-francaises-peuvent-elles-echapper-a-la-menace-ransomware-86089.html;le 11 Mars 2022;https://images.itnewsinfo.com/lmi/articles/moyen/000000084413.jpg
Des systemes Mitel servent a amplifier les attaques DDoS;https://www.lemondeinformatique.fr/actualites/lire-des-systemes-mitel-servent-a-amplifier-les-attaques-ddos-86082.html;le 10 Mars 2022;https://images.itnewsinfo.com/lmi/articles/moyen/000000084400.png
Phishing et ransomwares en tete des signalements sur Cybermalveillance en 2021;https://www.lemondeinformatique.fr/actualites/lire-phishing-et-ransomwares-en-tete-des-signalements-sur-cybermalveillance-en-2021-86049.html;le 08 Mars 2022;https://images.itnewsinfo.com/lmi/articles/moyen/000000084327.jpg
La NSA exhorte les entreprises a adopter le zero trust;https://www.lemondeinformatique.fr/actualites/lire-la-nsa-exhorte-les-entreprises-a-adopter-le-zero-trust-86053.html;le 08 Mars 2022;https://images.itnewsinfo.com/lmi/articles/moyen/000000084340.jpg
Conflit ukrainien : les recommandations de cybersecurite pour proteger les entreprises;https://www.lemondeinformatique.fr/actualites/lire-conflit-ukrainien-les-recommandations-de-cybersecurite-pour-proteger-les-entreprises-85992.html;le 03 Mars 2022;https://images.itnewsinfo.com/lmi/articles/moyen/000000084197.png
Apres les chats internes, le code source du ransomware Conti fuite;https://www.lemondeinformatique.fr/actualites/lire-apres-les-chats-internes-le-code-source-du-ransomware-conti-fuite-85996.html;le 02 Mars 2022;https://images.itnewsinfo.com/lmi/articles/moyen/000000084203.jpg
L'ENT des lycees franciliens touche par une cyberattaque (MAJ);https://www.lemondeinformatique.fr/actualites/lire-l-ent-des-lycees-franciliens-touche-par-une-cyberattaque-maj-85995.html;le 02 Mars 2022;https://images.itnewsinfo.com/lmi/articles/moyen/000000084202.jpg
Les US et l'Europe debranchent la Russie du reseau financier Swift;https://www.lemondeinformatique.fr/actualites/lire-les-us-et-l-europe-debranchent-la-russie-du-reseau-financier-swift-85958.html;le 28 Février 2022;https://images.itnewsinfo.com/lmi/articles/moyen/000000084133.jpg
Cloudflare pret a croquer Area 1 Security;https://www.lemondeinformatique.fr/actualites/lire-cloudflare-pret-a-croquer-area-1-security-85953.html;le 28 Février 2022;https://images.itnewsinfo.com/lmi/articles/moyen/000000084123.jpg
Forcepoint One reunit zero trust et SASE dans une plateforme de securite unique;https://www.lemondeinformatique.fr/actualites/lire-forcepoint-one-reunit-zero-trust-et-sase-dans-une-plateforme-de-securite-unique-85937.html;le 25 Février 2022;https://images.itnewsinfo.com/lmi/articles/moyen/000000084106.jpg
Les cyberattaques se multiplient en Ukraine attaque par la Russie;https://www.lemondeinformatique.fr/actualites/lire-les-cyberattaques-se-multiplient-en-ukraine-attaque-par-la-russie-85928.html;le 24 Février 2022;https://images.itnewsinfo.com/lmi/articles/moyen/000000084089.jpg
Ransomwares, supply chain : Blackberry radiographie les fleaux cyber de 2021;https://www.lemondeinformatique.fr/actualites/lire-ransomwares-supply-chain-blackberry-radiographie-les-fleaux-cyber-de-2021-85842.html;le 17 Février 2022;https://images.itnewsinfo.com/lmi/articles/moyen/000000083951.jpg
Akamai arrime le cloud de Linode a son CDN;https://www.lemondeinformatique.fr/actualites/lire-akamai-arrime-le-cloud-de-linode-a-son-cdn-85838.html;le 16 Février 2022;https://images.itnewsinfo.com/lmi/articles/moyen/000000083925.jpg
